{
  "model": {
    "id": "cid_edu_enterprise_platform",
    "name": "Nền tảng quản lý tích hợp Giáo dục và Doanh nghiệp",
    "version": 1,
    "notes": "Conceptual model for an integrated education and enterprise management platform, covering user management, organizational structure, course delivery, project management, and communication features."
  },
  "entities": [
    {
      "id": "cid_user",
      "name": "User",
      "kind": "strong",
      "attributes": [
        { "id": "cid_user_id", "name": "user_id", "kind": "simple", "isKey": true, "semantics": ["primary_key"] },
        { "id": "cid_username", "name": "username", "kind": "simple", "isKey": false, "semantics": ["unique_identifier"] },
        { "id": "cid_email", "name": "email", "kind": "simple", "isKey": false, "semantics": ["unique_identifier", "contact_info"] },
        { "id": "cid_password_hash", "name": "password_hash", "kind": "simple", "isKey": false, "semantics": ["security"] },
        { "id": "cid_first_name", "name": "first_name", "kind": "simple", "isKey": false },
        { "id": "cid_last_name", "name": "last_name", "kind": "simple", "isKey": false },
        { "id": "cid_full_name", "name": "full_name", "kind": "derived", "isKey": false, "derivation": "CONCAT(first_name, ' ', last_name)" },
        { "id": "cid_dob", "name": "dob", "kind": "simple", "isKey": false, "semantics": ["date_of_birth"] },
        { "id": "cid_gender", "name": "gender", "kind": "simple", "isKey": false },
        { "id": "cid_phone_numbers", "name": "phone_numbers", "kind": "multi_valued", "isKey": false, "semantics": ["contact_info"] },
        { "id": "cid_avatar_url", "name": "avatar_url", "kind": "simple", "isKey": false, "semantics": ["media_url"] },
        {
          "id": "cid_address",
          "name": "address",
          "kind": "composite",
          "isKey": false,
          "components": [
            { "id": "cid_address_street", "name": "street", "kind": "simple" },
            { "id": "cid_address_city", "name": "city", "kind": "simple" },
            { "id": "cid_address_state_province", "name": "state_province", "kind": "simple" },
            { "id": "cid_address_postal_code", "name": "postal_code", "kind": "simple" },
            { "id": "cid_address_country", "name": "country", "kind": "simple" }
          ],
          "semantics": ["location"]
        },
        { "id": "cid_timezone", "name": "timezone", "kind": "simple", "isKey": false },
        { "id": "cid_language", "name": "language", "kind": "simple", "isKey": false },
        { "id": "cid_status", "name": "status", "kind": "simple", "isKey": false, "semantics": ["account_status"] },
        { "id": "cid_created_at", "name": "created_at", "kind": "simple", "isKey": false, "semantics": ["timestamp"] },
        { "id": "cid_updated_at", "name": "updated_at", "kind": "simple", "isKey": false, "semantics": ["timestamp"] },
        { "id": "cid_last_login_at", "name": "last_login_at", "kind": "simple", "isKey": false, "semantics": ["timestamp"] },
        { "id": "cid_failed_login_attempts", "name": "failed_login_attempts", "kind": "simple", "isKey": false },
        { "id": "cid_email_verified", "name": "email_verified", "kind": "simple", "isKey": false },
        { "id": "cid_two_factor_enabled", "name": "two_factor_enabled", "kind": "simple", "isKey": false }
      ]
    },
    {
      "id": "cid_student",
      "name": "Student",
      "kind": "strong",
      "attributes": [
        { "id": "cid_student_id", "name": "student_id", "kind": "simple", "isKey": true, "semantics": ["primary_key", "foreign_key"] },
        { "id": "cid_enrollment_date", "name": "enrollment_date", "kind": "simple", "isKey": false, "semantics": ["timestamp"] },
        { "id": "cid_major", "name": "major", "kind": "simple", "isKey": false },
        { "id": "cid_gpa", "name": "gpa", "kind": "derived", "isKey": false, "derivation": "AVG(Enrollment.grade)" },
        { "id": "cid_student_status", "name": "student_status", "kind": "simple", "isKey": false },
        { "id": "cid_expected_graduation_date", "name": "expected_graduation_date", "kind": "simple", "isKey": false, "semantics": ["date"] }
      ]
    },
    {
      "id": "cid_instructor",
      "name": "Instructor",
      "kind": "strong",
      "attributes": [
        { "id": "cid_instructor_id", "name": "instructor_id", "kind": "simple", "isKey": true, "semantics": ["primary_key", "foreign_key"] },
        { "id": "cid_specialization", "name": "specialization", "kind": "multi_valued", "isKey": false },
        { "id": "cid_hire_date", "name": "hire_date", "kind": "simple", "isKey": false, "semantics": ["timestamp"] },
        { "id": "cid_bio", "name": "bio", "kind": "simple", "isKey": false },
        { "id": "cid_office_location", "name": "office_location", "kind": "simple", "isKey": false, "semantics": ["location"] },
        { "id": "cid_research_interests", "name": "research_interests", "kind": "multi_valued", "isKey": false },
        { "id": "cid_is_active", "name": "is_active", "kind": "simple", "isKey": false }
      ]
    },
    {
      "id": "cid_administrator",
      "name": "Administrator",
      "kind": "strong",
      "attributes": [
        { "id": "cid_admin_id", "name": "admin_id", "kind": "simple", "isKey": true, "semantics": ["primary_key", "foreign_key"] },
        { "id": "cid_admin_level", "name": "admin_level", "kind": "simple", "isKey": false },
        { "id": "cid_department_managed", "name": "department_managed", "kind": "simple", "isKey": false, "semantics": ["foreign_key"] },
        { "id": "cid_start_date", "name": "start_date", "kind": "simple", "isKey": false, "semantics": ["timestamp"] },
        { "id": "cid_responsibilities", "name": "responsibilities", "kind": "multi_valued", "isKey": false },
        { "id": "cid_is_super_admin", "name": "is_super_admin", "kind": "simple", "isKey": false }
      ]
    },
    {
      "id": "cid_employee",
      "name": "Employee",
      "kind": "strong",
      "attributes": [
        { "id": "cid_employee_id", "name": "employee_id", "kind": "simple", "isKey": true, "semantics": ["primary_key", "foreign_key"] },
        { "id": "cid_job_title", "name": "job_title", "kind": "simple", "isKey": false },
        { "id": "cid_department_id", "name": "department_id", "kind": "simple", "isKey": false, "semantics": ["foreign_key"] },
        { "id": "cid_hire_date", "name": "hire_date", "kind": "simple", "isKey": false, "semantics": ["timestamp"] },
        { "id": "cid_salary", "name": "salary", "kind": "simple", "isKey": false, "semantics": ["currency"] },
        { "id": "cid_employee_status", "name": "employee_status", "kind": "simple", "isKey": false },
        { "id": "cid_manager_user_id", "name": "manager_user_id", "kind": "simple", "isKey": false, "semantics": ["foreign_key"] }
      ]
    },
    {
      "id": "cid_organization",
      "name": "Organization",
      "kind": "strong",
      "attributes": [
        { "id": "cid_organization_id", "name": "organization_id", "kind": "simple", "isKey": true, "semantics": ["primary_key"] },
        { "id": "cid_name", "name": "name", "kind": "simple", "isKey": false },
        { "id": "cid_code", "name": "code", "kind": "simple", "isKey": false, "semantics": ["unique_identifier"] },
        { "id": "cid_tax_code", "name": "tax_code", "kind": "simple", "isKey": false, "semantics": ["unique_identifier"] },
        { "id": "cid_industry", "name": "industry", "kind": "simple", "isKey": false },
        { "id": "cid_size", "name": "size", "kind": "simple", "isKey": false },
        { "id": "cid_website", "name": "website", "kind": "simple", "isKey": false, "semantics": ["url"] },
        { "id": "cid_email", "name": "email", "kind": "simple", "isKey": false, "semantics": ["contact_info"] },
        { "id": "cid_phone", "name": "phone", "kind": "simple", "isKey": false, "semantics": ["contact_info"] },
        {
          "id": "cid_org_address",
          "name": "address",
          "kind": "composite",
          "isKey": false,
          "components": [
            { "id": "cid_org_address_street", "name": "street", "kind": "simple" },
            { "id": "cid_org_address_city", "name": "city", "kind": "simple" },
            { "id": "cid_org_address_state_province", "name": "state_province", "kind": "simple" },
            { "id": "cid_org_address_postal_code", "name": "postal_code", "kind": "simple" },
            { "id": "cid_org_address_country", "name": "country", "kind": "simple" }
          ],
          "semantics": ["location"]
        },
        { "id": "cid_created_at", "name": "created_at", "kind": "simple", "isKey": false, "semantics": ["timestamp"] },
        { "id": "cid_updated_at", "name": "updated_at", "kind": "simple", "isKey": false, "semantics": ["timestamp"] },
        { "id": "cid_status", "name": "status", "kind": "simple", "isKey": false },
        { "id": "cid_description", "name": "description", "kind": "simple", "isKey": false },
        { "id": "cid_logo_url", "name": "logo_url", "kind": "simple", "isKey": false, "semantics": ["media_url"] }
      ]
    },
    {
      "id": "cid_department",
      "name": "Department",
      "kind": "strong",
      "attributes": [
        { "id": "cid_department_id", "name": "department_id", "kind": "simple", "isKey": true, "semantics": ["primary_key"] },
        { "id": "cid_organization_id", "name": "organization_id", "kind": "simple", "isKey": false, "semantics": ["foreign_key"] },
        { "id": "cid_name", "name": "name", "kind": "simple", "isKey": false },
        { "id": "cid_description", "name": "description", "kind": "simple", "isKey": false },
        { "id": "cid_manager_id", "name": "manager_id", "kind": "simple", "isKey": false, "semantics": ["foreign_key"] },
        { "id": "cid_created_at", "name": "created_at", "kind": "simple", "isKey": false, "semantics": ["timestamp"] },